spying
User-Agent: Mozilla/5.0 (X11; U; Linux i686; en-US; rv:1.8.1.4) Gecko/20070515 Firefox/2.0.0.4
Build Identifier: Mozilla/5.0 (X11; U; Linux i686; en-US; rv:1.8.1.4) Gecko/20070515 Firefox/2.0.0.4

When I use firefox, sometimes when it is inactive I see heavy net load.
I have disabled all update checkboxes(Firefox,Addons,Engines) in preference dialog.
This is a cut from tcpdump output:

20:05:35.703249 IP 164.254.0.11.50073 > kc-in-f91.google.com.http: . ack 46112 win 2009 <nop,nop,timestamp 830526 776751729>
20:05:35.843254 IP kc-in-f91.google.com.http > 164.254.0.11.50073: . 46112:46636(524) ack 1 win 6288 <nop,nop,timestamp 776751729 830398>
20:05:35.843457 IP 164.254.0.11.50073 > kc-in-f91.google.com.http: . ack 46636 win 2009 <nop,nop,timestamp 830561 776751729>
20:05:36.015923 IP kc-in-f91.google.com.http > 164.254.0.11.50073: . 46636:47160(524) ack 1 win 6288 <nop,nop,timestamp 776751746 830439>
20:05:36.016140 IP 164.254.0.11.50073 > kc-in-f91.google.com.http: . ack 47160 win 2009 <nop,nop,timestamp 830604 776751746>
20:05:36.171050 IP kc-in-f91.google.com.http > 164.254.0.11.50073: . 47160:47684(524) ack 1 win 6288 <nop,nop,timestamp 776751746 830439>
20:05:36.171255 IP 164.254.0.11.50073 > kc-in-f91.google.com.http: . ack 47684 win 2009 <nop,nop,timestamp 830643 776751746>
20:05:36.339189 IP kc-in-f91.google.com.http > 164.254.0.11.50073: . 47684:48208(524) ack 1 win 6288 <nop,nop,timestamp 776751761 830477>
20:05:36.339396 IP 164.254.0.11.50073 > kc-in-f91.google.com.http: . ack 48208 win 2009 <nop,nop,timestamp 830685 776751761>


Reproducible: Sometimes

Steps to Reproduce:
1. Start firefox.
2. Wait until it load net.
Actual Results:
Strange net load.

Expected Results:
No net load.
